NOMBRE;MARCA;PESO;TIPO;CODIGO DE BARRAS;VENCIMIENTO;PAQUETE;TIPO DE CUIDADO;PRECIO PROVEEDOR;CANTIDAD:FECHA LLEGADA
Todorico Queso Todorico X 100gr;Todorico;100gr;Paquetes;69085957;24/12/2021;1;GONDOLA;1200;120;24/11/2021
Todorico Natural Todorico X 150gr;Todorico;150gr;Paquetes;61023542;10/12/2021;1;GONDOLA;1100;480;24/11/2021
Todorico Limon Todorico X 250gr;Todorico;250gr;Paquetes;61362009;20/12/2021;1;GONDOLA;1200;115;24/10/2021
Todorico BBQ Todorico X 200gr;Todorico;200gr;Paquetes;61005348;10/12/2021;1;GONDOLA;1500;50;01/12/2021
Todorico Pollo Todorico X 300gr;Todorico;300gr;Paquetes;13405902;12/12/2021;1;GONDOLA;990;90;24/11/2021
Todorico Pollo-Limon Todorico X 300gr;Todorico;300gr;Paquetes;13405903;12/12/2021;1;GONDOLA;990;90;24/09/2021
